{
  "J2": 0.000108262668,
  "GM": 398600441800000.0,
  "R_e": 6378137.0,
  "omega_sid_rad_s": 7.292115e-05,
  "gmst_model": "IAU_1982",
  "citation_id": "run_20261003_7f3a91c2",
  "source": {
    "J2": "spec II.10 constants table",
    "GM": "spec II.10 constants table",
    "R_e": "spec II.10 constants table",
    "omega_sid_rad_s": "spec II.10 constants table",
    "gmst_model": "spec IV constants_block"
  }
}
